{
  "capability_ids": [
    "capability:spatial-search",
    "capability:temporal-search",
    "capability:raster-read",
    "capability:reprojection",
    "capability:labeled-array-aggregation"
  ],
  "dataset_ids": [
    "DS-0002",
    "DS-0003"
  ],
  "divergences": [
    "Proposed partial method mapping; validate against pinned implementation code before declaring compatibility.",
    "NDVI anomaly and seasonal decisions have no canonical validated thresholds.",
    "Declared tool capabilities are intended production requirements; current backend availability is not audited."
  ],
  "implementation_version": "proposed-contract-1.0",
  "implemented_method_ids": [
    "method:ndvi-anomaly",
    "method:s1-backscatter-confirmation",
    "method:monthly-compositing",
    "method:temporal-persistence"
  ],
  "knowledge_snapshot": {
    "forest_cover_lab_revision": "d67e08354d748f1bd9423af1953de31244671f53",
    "graph_revision": "2a4093d8b1c83d6bf8b5e47f88df3be1643aeb751a9994532b062ce677bc35e1"
  },
  "observation_ids": [
    "observation:forest-baseline",
    "observation:optical-vegetation-state",
    "observation:sar-backscatter-state",
    "observation:temporal-persistence",
    "observation:forest-cover-change",
    "observation:disturbance-confirmation"
  ],
  "reporting_contracts": [
    "report/reporting_contract.md"
  ],
  "schema_version": "1.0",
  "status": "proposed",
  "tool_ids": [
    "tool:stac-client",
    "tool:rasterio",
    "tool:xarray"
  ],
  "validation_contracts": [
    "validate/validation_plan.md"
  ],
  "validation_ids": [
    "validation:forest-evidence"
  ],
  "workflow_id": "workflow:sentinel-monthly-forest-cover"
}
